{"assurance_ref":null,"completion_knowledge":"unknown","effect_extension":{"schema":"workcell.git-correlation/v1alpha1","values":{"transaction_sha256":"5677610f24e71ec0016b426b1dc11cf5039e2ac81e380132a31b37ced73b4d01","workcell_effect_id":"workcell-logical-git-1"}},"execution_result_ref":"sha256:20cf28d04e38232afa7c88077ed1c404903884698880bfa2da8d94f010a37438","participant":{"invocation_id":"30fb9f94-2ee0-4aae-ac8a-f2e5d460e536","namespace":"kujolang.python-process"},"participant_extension":{"schema":"kujolang.python-process-correlation/v1alpha1","values":{"call_id":"native-call-1","process_instance_id":"39985a1b-42a7-4ebb-9e34-229448003723"}},"schema":"kujo.interop-handoff/v1alpha1","subject":{"attempt_id":"1","effect_id":"effect-1","run_id":"run-1790557382461-6724","step_id":"action"}}