{"assurance_ref":"sha256:43a1cb16e71ddb499802ce91ba6451aa9f43b69e4d9db9194cd1145ac598e595","completion_knowledge":"unknown","effect_extension":{"schema":"workcell.git-correlation/v1alpha1","values":{"transaction_sha256":"ef17c32b9cb5d0916ddab20da51b42be1766c4eefba7de73169894eb73be5df7","workcell_effect_id":"workcell-logical-git-1"}},"execution_result_ref":"sha256:170525816e87f0b7da99cc195cd1c82b6518682262d92b7a76ba53d30a26430b","participant":{"invocation_id":"aae20423-5681-40de-be07-8aaf97cb71fa","namespace":"kujolang.python-process"},"participant_extension":{"schema":"kujolang.python-process-correlation/v1alpha1","values":{"call_id":"native-call-1","process_instance_id":"f91b0a5f-0f1c-4fce-a723-0104d508b353"}},"schema":"kujo.interop-handoff/v1alpha1","subject":{"attempt_id":"1","effect_id":"effect-1","run_id":"run-1790557370802-6102","step_id":"action"}}