{"assurance_ref":"sha256:179b534c382c7709359c5b3fb63c44817909ba197fdd8c89f329ed657147819c","completion_knowledge":"unknown","effect_extension":{"schema":"workcell.git-correlation/v1alpha1","values":{"transaction_sha256":"433dfb8cd1caf36fee00a93f151f29564acd361a939748fcaed3bcdaaef3d47f","workcell_effect_id":"workcell-logical-git-1"}},"execution_result_ref":"sha256:55a406bf46951aa7107c23e58b1fab5e4072f0a1310f7b87986356a703dd7601","participant":{"invocation_id":"b2006aff-5890-45de-8108-31125b302458","namespace":"workcell.process"},"participant_extension":{"schema":"workcell.process-correlation/v1alpha1","values":{"outcome":"completion_lost","participant_call_id":"process-call-1","participant_id":"local-git-process"}},"schema":"kujo.interop-handoff/v1alpha1","subject":{"attempt_id":"1","effect_id":"effect-1","run_id":"run-1790540223330-4617","step_id":"action"}}