{"assurance_ref":"sha256:fc08ec232eda96a00a699e7841962373dfc6f4d3ef64e29d5eca8994ca43a013","completion_knowledge":"reported","effect_extension":{"schema":"ability.effect-correlation/v1alpha1","values":{"ability_id":"kujo.fixture.publication.create","ability_invocation_id":"application-publication","ability_version":"1.0.0","definition_digest":"7b4d3b40ac011a31f3e2d9c7641c4a7fe99c993a0688a923df1bcabb3dc107ac","receipt_id":"receipt-967b81878164dd4e25f4252525c66107","receipt_ref":"sha256:492ecbff24fb06e8fe969e243ed49ab8f0e883c07560c83d798101adc5b71f8f","transaction_sha256":"32a720413061357e2ecff8060a8358696c47ae16c8b255a952a39b5dcf3fd7c6"}},"execution_result_ref":"sha256:3276490a4784ffcad186c5063f5a033cca5947dd6efeda9c3586949fe7143d41","participant":{"invocation_id":"0cd1e302-96f1-46bf-b293-14d4c4f80d37","namespace":"mcp.stdio-tool"},"participant_extension":{"schema":"mcp.stdio-tool-correlation/v1alpha1","values":{"mcp_request_id":"4c757a4b-f673-4741-a581-1b886f3f4c80","mcp_server_id":"publication-server","mcp_session_id":"mcp-run-1790540380896-5891-1","outcome":"receipt_succeeded","rpc_request_id":"rpc-call-1","tool_name":"publish"}},"schema":"kujo.interop-handoff/v1alpha1","subject":{"attempt_id":"1","effect_id":"effect-1","run_id":"run-1790540380896-5891","step_id":"action"}}