{"assurance_ref":"sha256:d0809a98fb5fcd6494975ae80846b379fb77ab0fa417dd67154f378e775fd61c","completion_knowledge":"unknown","effect_extension":{"schema":"ability.effect-correlation/v1alpha1","values":{"ability_id":"kujo.fixture.publication.create","ability_invocation_id":"application-publication","ability_version":"1.0.0","definition_digest":"7b4d3b40ac011a31f3e2d9c7641c4a7fe99c993a0688a923df1bcabb3dc107ac","receipt_id":"receipt-1af7dae971ac667c91a6703c2d7472e0","receipt_ref":"sha256:7d0609ef248bcd5bf955c773ffb4be2d0d243a505bd0c61888c6680259194a12","transaction_sha256":"1edb4beb8b8d7beec904823c04577e8cc9d5ada67ff86f9b1eed61586f0e2270"}},"execution_result_ref":"sha256:aeb55edca12eb4c71b329502f743c5f9bbfa246c939775f15dc956f908cca171","participant":{"invocation_id":"456b6e4e-ab80-4754-aa71-ddea6ecd68ed","namespace":"http.operation"},"participant_extension":{"schema":"http.operation-correlation/v1alpha1","values":{"client_request_id":"client-call-1","method":"POST","operation_id":"publication_create","outcome":"response_lost","route_id":"publication_run"}},"schema":"kujo.interop-handoff/v1alpha1","subject":{"attempt_id":"1","effect_id":"effect-1","run_id":"run-1790540271988-7924","step_id":"action"}}