{"assurance_ref":"sha256:6db67a7b6112c7c8d296b1edfdc58ae8b6a2c3a5fb5f76b65b9e83ac3f7a4920","completion_knowledge":"unknown","effect_extension":{"schema":"workcell.git-correlation/v1alpha1","values":{"transaction_sha256":"c595f44959327fd57e8636411587818b0c3c5a85a25b968c38f2d1ce69d63d3b","workcell_effect_id":"workcell-logical-git-1"}},"execution_result_ref":"sha256:7ec2a168c7602db8efca2733e2f7662100956ebe28f8551cddddfd9c898ec548","participant":{"invocation_id":"f83811f4-f65f-428f-909e-1b1f88b07aac","namespace":"kujolang.python-process"},"participant_extension":{"schema":"kujolang.python-process-correlation/v1alpha1","values":{"call_id":"native-call-1","process_instance_id":"7c5f5486-1c8d-4646-b44f-d834fa71a925"}},"schema":"kujo.interop-handoff/v1alpha1","subject":{"attempt_id":"1","effect_id":"effect-1","run_id":"run-1790561582791-4985","step_id":"action"}}