{"assurance_ref":"sha256:03c10fad196a01908f4c1975fd6b9e00ff9456e72c20fb469d15527caeca3257","completion_knowledge":"unknown","effect_extension":{"schema":"workcell.git-correlation/v1alpha1","values":{"transaction_sha256":"8cdf6ba5a1c1ab68db3859b35ffc9b484cf1e84539a346d142696559ba32a088","workcell_effect_id":"workcell-logical-native-1"}},"execution_result_ref":"sha256:28186b9763c0ec35d98bec517bce0802a4b7115bc348080e1204531808f6e1ef","participant":{"invocation_id":"aa932a39-ef18-4f5d-83be-0c57695709c5","namespace":"kujolang.typescript-process"},"participant_extension":{"schema":"kujolang.typescript-process-correlation/v1alpha1","values":{"call_id":"native-call-1","process_instance_id":"4ad66d52-17cb-45c5-9af0-7aa86a8db0a3"}},"schema":"kujo.interop-handoff/v1alpha1","subject":{"attempt_id":"1","effect_id":"effect-1","run_id":"run-1790550478607-8196","step_id":"action"}}