{"assurance_ref":"sha256:f0418264ac1d0734e4e325cdc0351d0baba0812a178277a67dbb6ffb28a703e1","completion_knowledge":"unknown","effect_extension":{"schema":"workcell.git-correlation/v1alpha1","values":{"transaction_sha256":"411d5fbcbaa4c6fb5b441148071a41d17168caaaf27d87df0e288e5d3c953096","workcell_effect_id":"workcell-logical-native-1"}},"execution_result_ref":"sha256:f244d8269e60a65bb6ee29a32103b82a7cdab56f393f20b055c142d22b784add","participant":{"invocation_id":"cd3d4774-99db-4034-b1f3-5789e77e572c","namespace":"kujolang.typescript-process"},"participant_extension":{"schema":"kujolang.typescript-process-correlation/v1alpha1","values":{"call_id":"native-call-1","process_instance_id":"e028b247-c387-4bc3-99fa-d9f395285237"}},"schema":"kujo.interop-handoff/v1alpha1","subject":{"attempt_id":"1","effect_id":"effect-1","run_id":"run-1790550443166-7381","step_id":"action"}}