{"assurance_ref":null,"completion_knowledge":"unknown","effect_extension":{"schema":"workcell.git-correlation/v1alpha1","values":{"transaction_sha256":"74fb7369e5c9899107f5f2e0359e034b6f7a5ab0aa2ee91799f48c835a179623","workcell_effect_id":"workcell-logical-git-1"}},"execution_result_ref":"sha256:20e6af5f0e691e19ac1029f0b9cfc6e6061c2d2d0f94a0c32fc8a01d3297fa0a","participant":{"invocation_id":"54999385-7584-4a50-8900-5335620a15ca","namespace":"kujolang.python-process"},"participant_extension":{"schema":"kujolang.python-process-correlation/v1alpha1","values":{"call_id":"native-call-1","process_instance_id":"875c84c5-92e8-4296-b9d8-872279d433e2"}},"schema":"kujo.interop-handoff/v1alpha1","subject":{"attempt_id":"1","effect_id":"effect-1","run_id":"run-1790561571067-5411","step_id":"action"}}