{"assurance_ref":null,"completion_knowledge":"unknown","effect_extension":{"schema":"workcell.git-correlation/v1alpha1","values":{"transaction_sha256":"acf9c3ca1d551e091c14938b9610d03d1848b922e0a04dfb19c2a51660196f55","workcell_effect_id":"workcell-logical-native-1"}},"execution_result_ref":"sha256:aff6af6ea2181670c5b620bfe1d3add9961068fcd640bad46307116800487274","participant":{"invocation_id":"1024e3fa-d169-4b02-bbd8-389d2185537d","namespace":"kujolang.typescript-process"},"participant_extension":{"schema":"kujolang.typescript-process-correlation/v1alpha1","values":{"call_id":"native-call-1","process_instance_id":"dc025b88-6900-4371-84d6-44647dcc68aa"}},"schema":"kujo.interop-handoff/v1alpha1","subject":{"attempt_id":"1","effect_id":"effect-1","run_id":"run-1790561610264-6724","step_id":"action"}}