{"assurance_ref":null,"completion_knowledge":"unknown","effect_extension":{"schema":"workcell.git-correlation/v1alpha1","values":{"transaction_sha256":"29f15b95420f31b89231abf5d301f5fa05a7f8670aa9fb2b1409a9c5394235c5","workcell_effect_id":"workcell-logical-native-1"}},"execution_result_ref":"sha256:55fff0f2d9a8c6c3fd4523c63980de9673c013754f0cc98d02dbd0ab54adcf4a","participant":{"invocation_id":"88381869-4586-4ad3-b10d-e50c5f975830","namespace":"kujolang.typescript-process"},"participant_extension":{"schema":"kujolang.typescript-process-correlation/v1alpha1","values":{"call_id":"native-call-1","process_instance_id":"acc60593-190a-4306-bfa0-ad31b4bf5850"}},"schema":"kujo.interop-handoff/v1alpha1","subject":{"attempt_id":"1","effect_id":"effect-1","run_id":"run-1790561642782-7112","step_id":"action"}}