{"assurance_ref":"sha256:3d6c90b88f6f1027224fb917773cf43ef50993ac8eebef2da7efd25725b58e06","completion_knowledge":"reported","effect_extension":{"schema":"ability.effect-correlation/v1alpha1","values":{"ability_id":"kujo.fixture.publication.create","ability_invocation_id":"application-publication","ability_version":"1.0.0","definition_digest":"7b4d3b40ac011a31f3e2d9c7641c4a7fe99c993a0688a923df1bcabb3dc107ac","receipt_id":"receipt-a886c6f86a887985619a167c026a7ee2","receipt_ref":"sha256:6545cdb6090f54ca0a07dd90773c5739b7b2042e5b262763c84118316df3c3ed","transaction_sha256":"296edc3179e499d7e64d3322b12ca86ffe1f4cbea311fd5055792b70d0d4a38e"}},"execution_result_ref":"sha256:d5c79a83a679169f161e198181fc203f79f049e46546896987b0b9850326ba15","participant":{"invocation_id":"step-7","namespace":"agents-sdk.tool"},"participant_extension":{"schema":"agents-sdk.tool-correlation/v1alpha1","values":{"outcome":"receipt_failed","sdk_run_id":"sdk-run-1790540406307-4725-1","tool_call_id":"model-call-1","tool_name":"publish"}},"schema":"kujo.interop-handoff/v1alpha1","subject":{"attempt_id":"1","effect_id":"effect-1","run_id":"run-1790540406307-4725","step_id":"action"}}