{"schema":"kujo.interop-handoff/v1alpha1","subject":{"run_id":"proof-run","step_id":"proof-step","attempt_id":"1","effect_id":"proof-effect"},"participant":{"namespace":"pilot.lantern","invocation_id":"proof-invocation"},"completion_knowledge":"unknown","execution_result_ref":"sha256:30a7135c8171343b50850cfa482cad4972c88f5a5d1ad635ae6a267ac2fcbf75","assurance_ref":null,"participant_extension":{"schema":"pilot.lantern-correlation/v1alpha1","values":{"session_tag":"proof-session","exchange_tag":"proof-exchange"}},"effect_extension":null}